{
  "schema_version": "ga4gh-relevance-catalog-v1",
  "status": "relevance_assessed_governance_only",
  "selection_policy": "Lifecycle maturity is recorded but never used as an exclusion criterion. A product is relevant when an explicit, proposed, or testable mapping path connects it to HPO-coded phenotypes, their provenance, downstream genomic interpretation, cohort discovery, or governed data use.",
  "mapping_evidence_levels": ["explicit_standard_mapping", "documented_interoperability", "proposed_alignment", "testable_adjacency"],
  "products": [
    {"product_id":"phenopackets","name":"Phenopackets","lifecycle":"current_active_draft_v2","product_type":"data_model","mapping_evidence":"explicit_standard_mapping","mapping_paths":["Phenopacket PhenotypicFeature -> HPO OntologyClass CURIE","Phenopacket VariationDescriptor -> version-compatible VRS representation","Phenopacket Resource -> exact ontology version"],"hpo_use":"round-trip and semantic-preservation evaluation envelope","languages":[],"direct_lexical_vote":false,"payload_authorized":false},
    {"product_id":"pedigree","name":"Pedigree","lifecycle":"current_active_developmental","product_type":"data_model","mapping_evidence":"testable_adjacency","mapping_paths":["Pedigree individual -> Phenopacket subject","family segregation -> HPO-coded PhenotypicFeature consistency"],"hpo_use":"family-consistency and segregation-sensitive translation evaluation","languages":[],"direct_lexical_vote":false,"payload_authorized":false},
    {"product_id":"human-exposome","name":"Human Exposome Data Standards","lifecycle":"current_active_study_group","product_type":"data_model","mapping_evidence":"documented_interoperability","mapping_paths":["Exposure feature -> proposed Phenopackets extension","Exposure concept -> ECTO or other governed exposure ontology","Exposure timeline -> phenotype onset and resolution context"],"hpo_use":"exposure-versus-phenotype disambiguation and longitudinal context","languages":[],"direct_lexical_vote":false,"payload_authorized":false},
    {"product_id":"vrs","name":"Variation Representation Specification","lifecycle":"current_active_v2","product_type":"data_model","mapping_evidence":"documented_interoperability","mapping_paths":["VRS variation -> Phenopacket genomic interpretation","VRS identifier -> VA statement subject"],"hpo_use":"stable variant identity for downstream phenotype-ranking evaluation","languages":[],"direct_lexical_vote":false,"payload_authorized":false},
    {"product_id":"cat-vrs","name":"Categorical Variation Representation Specification","lifecycle":"current_active_v1","product_type":"data_model","mapping_evidence":"documented_interoperability","mapping_paths":["Cat-VRS categorical variant -> VRS variation constraints","Categorical variant -> VA knowledge statement"],"hpo_use":"category-level variant and phenotype-ranking robustness","languages":[],"direct_lexical_vote":false,"payload_authorized":false},
    {"product_id":"va-spec","name":"Variant Annotation Specification","lifecycle":"current_active_v1","product_type":"data_model","mapping_evidence":"documented_interoperability","mapping_paths":["VA statement -> VRS or Cat-VRS subject","VA evidence -> phenotype-associated clinical assertion"],"hpo_use":"provenance-preserving genotype-phenotype outcome evaluation","languages":[],"direct_lexical_vote":false,"payload_authorized":false},
    {"product_id":"sequence-annotation","name":"Sequence Annotation","lifecycle":"current_active_developmental","product_type":"data_model","mapping_evidence":"proposed_alignment","mapping_paths":["Sequence feature -> VRS location or molecular consequence","Sequence feature annotation -> VA evidence context"],"hpo_use":"mechanistic downstream consistency checks","languages":[],"direct_lexical_vote":false,"payload_authorized":false},
    {"product_id":"pharmacogenomics","name":"Pharmacogenomics Data Standardisation","lifecycle":"study_group","product_type":"data_model_study","mapping_evidence":"testable_adjacency","mapping_paths":["PGx variant -> VRS or Cat-VRS","PGx assertion -> VA","Medicine identity -> governed ATC, RxNorm or ChEBI context","Clinical phenotype -> HPO-coded outcome"],"hpo_use":"drug-response phenotype disambiguation and adverse-event controls","languages":[],"direct_lexical_vote":false,"payload_authorized":false},
    {"product_id":"expmeta","name":"Experiments Metadata Checklist","lifecycle":"current_active","product_type":"metadata_model","mapping_evidence":"testable_adjacency","mapping_paths":["Experiment metadata -> assay and provenance context for phenotype evidence","Experiment bias fields -> source-quality and confidence covariates"],"hpo_use":"process provenance, bias and reproducibility analysis","languages":[],"direct_lexical_vote":false,"payload_authorized":false},
    {"product_id":"wgs-qc","name":"Whole Genome Sequencing Quality Control Standards","lifecycle":"current_active","product_type":"quality_model","mapping_evidence":"testable_adjacency","mapping_paths":["WGS quality metric -> reliability of variant evidence used in phenotype ranking","QC provenance -> downstream confidence covariate"],"hpo_use":"negative control and downstream evidence-quality stratification","languages":[],"direct_lexical_vote":false,"payload_authorized":false},
    {"product_id":"duo","name":"Data Use Ontology","lifecycle":"current_active_v1","product_type":"governance_ontology","mapping_evidence":"explicit_standard_mapping","mapping_paths":["Dataset -> DUO permitted-use term","DUO disease-specific restriction -> governed MONDO context","Beacon dataset access condition -> DUO term"],"hpo_use":"machine-readable use eligibility; never copyright or consent authority","languages":["en"],"direct_lexical_vote":false,"payload_authorized":false},
    {"product_id":"data-passports","name":"Data Passports","lifecycle":"current_active_developmental","product_type":"governance_data_model","mapping_evidence":"documented_interoperability","mapping_paths":["Data Passport visa -> dataset access policy attribute","Data Passport -> GA4GH Passport identity and access flow","Dataset use condition -> DUO"],"hpo_use":"enforce access boundaries for restricted phenotype benchmarks","languages":[],"direct_lexical_vote":false,"payload_authorized":false},
    {"product_id":"beacon","name":"Beacon","lifecycle":"current_active_v2","product_type":"discovery_api_data_model","mapping_evidence":"explicit_standard_mapping","mapping_paths":["Beacon semantic phenotype filter -> HPO CURIE","Beacon dataset access condition -> DUO","Beacon genomic variation -> VRS-compatible representation where endpoint profile declares it"],"hpo_use":"translated-query retrieval invariance and cohort-selection analysis","languages":[],"direct_lexical_vote":false,"payload_authorized":false},
    {"product_id":"phenopacket-store","name":"Phenopacket Store","lifecycle":"maintained_dataset_exact_commit_required","product_type":"benchmark_dataset","mapping_evidence":"explicit_standard_mapping","mapping_paths":["Case -> Phenopacket schema","PhenotypicFeature -> HPO CURIE","Genomic interpretation -> version-specific variation representation"],"hpo_use":"gene and disease ranking, leakage testing and semantic perturbation","languages":["source_language_unverified"],"direct_lexical_vote":false,"payload_authorized":false}
  ],
  "controls": {"maturity_exclusion_allowed":false,"mapping_path_required":true,"empirical_execution_authorized":false,"payload_retrieval_authorized":false,"new_freeze_required":true,"automatic_promotion_allowed":false}
}
